{
  "slug": "work",
  "name": "Work",
  "author": {
    "name": "Tyler",
    "url": "https://x.com/TylerNishida"
  },
  "summary": "The work-side counterpart to Life, one door for professional tasks",
  "summary_zh": "和工作外的 Life 成对，专业事务走这一扇门。",
  "import": "https://x.ai/bot/vOipeiu0AZ7CuC5ynw5h0",
  "source": "https://x.com/TylerNishida/status/2093426221732532457",
  "related": "https://grokbot.dev/bots/work-work-door",
  "first_safe_task": "List the connectors you currently see. Do not send mail, create events, or message anyone.",
  "approval_boundary": "Never send, create events, or message people without an explicit yes in chat.",
  "category": "teams-handoffs",
  "tags": [
    "two-door",
    "work"
  ],
  "license": "CC0-1.0",
  "verified": false,
  "updated": "2026-08-30",
  "shelf": "raw"
}
