{
  "slug": "home-robots",
  "name": "Home robots",
  "author": {
    "name": "Sawyer",
    "url": "https://x.com/SawyerMerritt"
  },
  "summary": "Control your mower, vacuum and other Matter home robots from one chat",
  "summary_zh": "在一个聊天窗口里控制割草机、扫地机和其他 Matter 家用机器人。",
  "import": "https://x.ai/bot/3mf-UN4mGnCp8DbPBnW5u",
  "source": "https://x.com/SawyerMerritt/status/2093384986162352495",
  "related": "https://grokbot.dev/bots/home-robots",
  "mcp_custom": true,
  "first_safe_task": "List connected robots and their current status. Do not start, pause, dock, or change any robot.",
  "approval_boundary": "Never start, pause, dock, or change a robot without an explicit yes in chat.",
  "category": "personal-admin",
  "tags": [
    "home",
    "robots",
    "matter"
  ],
  "license": "CC0-1.0",
  "verified": false,
  "updated": "2026-08-30",
  "shelf": "raw"
}
