{
  "slug": "fixer",
  "name": "Fixer",
  "author": {
    "name": "Uzi",
    "url": "https://x.com/UziObi"
  },
  "summary": "The operator that actually does the work, and pushes back when a plan is wrong",
  "summary_zh": "真正动手的执行手，计划不对会顶回去。",
  "import": "https://x.ai/bot/jiF_km66YLNm5LBVJ5_Ho",
  "source": "https://x.com/UziObi/status/2093401597048975758",
  "related": "https://grokbot.dev/bots/fixer-uzi",
  "first_safe_task": "Restate your job and approval boundary in five bullets. Do not message people, spawn bots, or start routines.",
  "approval_boundary": "Never send, pay, delete, or file anything without an explicit yes in chat.",
  "category": "teams-handoffs",
  "tags": [
    "operator",
    "chief-of-staff"
  ],
  "license": "CC0-1.0",
  "verified": false,
  "updated": "2026-08-30",
  "shelf": "raw"
}
