{
  "slug": "dr-eggbot",
  "name": "dr eggbot",
  "author": {
    "name": "Lauren",
    "url": "https://x.com/poteto"
  },
  "summary": "A bot that builds other Grok bots for you",
  "summary_zh": "替你搭建其他 Grok Bot。",
  "import": "https://x.ai/bot/93gOz3op1UQdBdbekQFLK",
  "source": "https://x.com/poteto/status/2093392701005946931",
  "related": "https://grokbot.dev/bots/dr-eggbot",
  "first_safe_task": "Ask the listed preference questions in chat. Do not create any agent until the owner answers.",
  "approval_boundary": "Never create, share, or delete a bot without an explicit yes in chat.",
  "category": "coding-shipping",
  "tags": [
    "create-agent",
    "bots"
  ],
  "license": "CC0-1.0",
  "verified": false,
  "updated": "2026-08-30",
  "shelf": "raw"
}
