{
  "slug": "life",
  "name": "Life",
  "author": {
    "name": "Tyler",
    "url": "https://x.com/TylerNishida"
  },
  "summary": "A standing inbox for everything personal that spawns the bots you need",
  "summary_zh": "私人事务的常驻收件箱，需要时再拉出对应 Bot。",
  "import": "https://x.ai/bot/6I-yjMRU1BmiYNfZgWXBK",
  "source": "https://x.com/TylerNishida/status/2093426221732532457",
  "related": "https://grokbot.dev/bots/life-life-door",
  "first_safe_task": "List the rooms or sibling bots you would open. Do not spawn anyone or send messages.",
  "approval_boundary": "Never spawn bots, send messages, or create events without an explicit yes in chat.",
  "category": "teams-handoffs",
  "tags": [
    "two-door",
    "life"
  ],
  "license": "CC0-1.0",
  "verified": false,
  "updated": "2026-08-30",
  "shelf": "aka"
}
